{
  "layoutId": "split-hero",
  "description": "Large left assertion with right hero card.",
  "background": "{colors.bg}",
  "slots": {
    "eyebrow": { "x": 120, "y": 92, "w": 760, "h": 40 },
    "title": { "x": 120, "y": 160, "w": 760, "h": 360 },
    "body": { "x": 124, "y": 650, "w": 720, "h": 170 },
    "heroCard": { "x": 1010, "y": 160, "w": 760, "h": 630 },
    "heroTitle": { "x": 1080, "y": 240, "w": 620, "h": 180 },
    "heroBody": { "x": 1080, "y": 555, "w": 620, "h": 180 },
    "footer": { "x": 124, "y": 930, "w": 1120, "h": 42 }
  }
}
