{
  "layoutId": "diagram",
  "description": "Three-node diagram with connector lines.",
  "background": "{colors.bg}",
  "slots": {
    "eyebrow": { "x": 96, "y": 70, "w": 900, "h": 32 },
    "title": { "x": 96, "y": 126, "w": 1220, "h": 126 },
    "body": { "x": 96, "y": 275, "w": 1180, "h": 82 },
    "node1": { "x": 120, "y": 430, "w": 430, "h": 260 },
    "node1Title": { "x": 155, "y": 470, "w": 360, "h": 48 },
    "node1Body": { "x": 155, "y": 535, "w": 360, "h": 110 },
    "edge1": { "x": 580, "y": 560, "w": 145, "h": 1 },
    "node2": { "x": 745, "y": 430, "w": 430, "h": 260 },
    "node2Title": { "x": 780, "y": 470, "w": 360, "h": 48 },
    "node2Body": { "x": 780, "y": 535, "w": 360, "h": 110 },
    "edge2": { "x": 1205, "y": 560, "w": 145, "h": 1 },
    "node3": { "x": 1370, "y": 430, "w": 430, "h": 260 },
    "node3Title": { "x": 1405, "y": 470, "w": 360, "h": 48 },
    "node3Body": { "x": 1405, "y": 535, "w": 360, "h": 110 },
    "footer": { "x": 96, "y": 980, "w": 1200, "h": 32 }
  }
}
